run_20260311_001604/incident_explanations.json

{
  "incidents": [
    {
      "incident_id": "I1",
      "start_time": "2023-01-27T18:28:08.127428+00:00",
      "end_time": "2023-01-27T18:29:58.127428+00:00",
      "explanations": [
        {
          "cluster_id": "C163",
          "behavior": "Gatekeeper policy evaluation failures",
          "score": 59.863260276972724,
          "narrative": {
            "root_cause": "gatekeeper resource_lookup_failure",
            "behavior": "Gatekeeper policy evaluation failures",
            "trigger_event": "\"{\"\"name\"\":\"\"k8s-master-perfspec\"\"}\",2023-01-27T18:28:22.470778Z,system:serviceaccount:gatekeeper-system:gatekeeper-admin,list,assignmetadata,,,,/apis/mutations.gatekeeper.sh/v1/assignmetadata?resourceVersion=6135961,2c893351-f825-40f8-9bf7-19ff1de0fb4f,ResponseComplete,404,,,",
            "propagation_clusters": [
              "C118",
              "C152",
              "C156",
              "C161",
              "C179",
              "C18",
              "C181",
              "C187",
              "C220",
              "C36",
              "C7",
              "C96"
            ],
            "blast_radius": 12
          },
          "explanation": [
            "Behavior: system:serviceaccount:gatekeeper-system:gatekeeper-admin list constrainttemplates (HTTP 404)",
            "Cluster size: 112 events",
            "Error burst detected: 108 anomalous events",
            "Trigger proximity to incident start: 1.0",
            "Downstream clusters affected: 12"
          ]
        },
        {
          "cluster_id": "C31",
          "behavior": "my-kube-prometheus-stack-operator get secrets operations (HTTP 200)",
          "score": 30.98595923574128,
          "narrative": {
            "root_cause": "prometheus normal_operation",
            "behavior": "my-kube-prometheus-stack-operator get secrets operations (HTTP 200)",
            "trigger_event": "\"{\"\"name\"\":\"\"k8s-master-perfspec\"\"}\",2023-01-27T18:29:12.022671Z,system:serviceaccount:kube-prometheus-stack:my-kube-prometheus-stack-operator,update,secrets,,prometheus-my-kube-prometheus-stack-prometheus,,/api/v1/namespaces/kube-prometheus-stack/secrets/prometheus-my-kube-prometheus-stack-prometheus,a8c7090c-c03f-429d-b2a7-0805a0e74172,ResponseComplete,200,,,",
            "propagation_clusters": [
              "C152",
              "C156",
              "C161",
              "C169",
              "C175",
              "C181",
              "C187",
              "C220",
              "C36",
              "C47",
              "C50",
              "C7",
              "C76",
              "C77",
              "C96"
            ],
            "blast_radius": 15
          },
          "explanation": [
            "Behavior: system:serviceaccount:kube-prometheus-stack:my-kube-prometheus-stack-operator get secrets (HTTP 200)",
            "Cluster size: 1343 events",
            "Error burst detected: 222 anomalous events",
            "Trigger proximity to incident start: 0.482",
            "Downstream clusters affected: 15"
          ]
        },
        {
          "cluster_id": "C165",
          "behavior": "kubernetes-admin get clusterroles client failures (HTTP 404)",
          "score": 30.42997879569428,
          "narrative": {
            "root_cause": "Unknown Component normal_operation",
            "behavior": "kubernetes-admin get clusterroles client failures (HTTP 404)",
            "trigger_event": "\"{\"\"name\"\":\"\"k8s-master-perfspec\"\"}\",2023-01-27T18:29:56.281482Z,kubernetes-admin,delete,rolebindings,,my-cert-manager-startupapicheck:create-cert,,/apis/rbac.authorization.k8s.io/v1/namespaces/cert-manager/rolebindings/my-cert-manager-startupapicheck:create-cert,bae1136b-888d-4fd1-b29a-a5f0bcbfed83,ResponseComplete,200,,,",
            "propagation_clusters": [],
            "blast_radius": 0
          },
          "explanation": [
            "Behavior: kubernetes-admin get clusterroles (HTTP 404)",
            "Cluster size: 34 events",
            "Error burst detected: 28 anomalous events",
            "Trigger proximity to incident start: 0.028"
          ]
        },
        {
          "cluster_id": "C18",
          "behavior": "kubernetes-admin create customresourcedefinitions client failures (HTTP 409)",
          "score": 28.450214355039588,
          "narrative": {
            "root_cause": "Unknown Component resource_lookup_failure",
            "behavior": "kubernetes-admin create customresourcedefinitions client failures (HTTP 409)",
            "trigger_event": "\"{\"\"name\"\":\"\"k8s-master-perfspec\"\"}\",2023-01-27T18:28:47.909502Z,kubernetes-admin,create,customresourcedefinitions,,alertmanagerconfigs.monitoring.coreos.com,,/apis/apiextensions.k8s.io/v1/customresourcedefinitions?fieldManager=helm,68e32d5e-d001-4651-ae3c-00b45521c45b,ResponseComplete,409,,,",
            "propagation_clusters": [
              "C152",
              "C156",
              "C161",
              "C175",
              "C181",
              "C187",
              "C220",
              "C31",
              "C36",
              "C50",
              "C7",
              "C76",
              "C77",
              "C96"
            ],
            "blast_radius": 14
          },
          "explanation": [
            "Behavior: kubernetes-admin create customresourcedefinitions (HTTP 409)",
            "Cluster size: 30 events",
            "Error burst detected: 17 anomalous events",
            "Trigger proximity to incident start: 0.676",
            "Downstream clusters affected: 14"
          ]
        },
        {
          "cluster_id": "C19",
          "behavior": "kubernetes-admin get configmaps client failures (HTTP 404)",
          "score": 27.109072478639135,
          "narrative": {
            "root_cause": "Unknown Component resource_lookup_failure",
            "behavior": "kubernetes-admin get configmaps client failures (HTTP 404)",
            "trigger_event": "\"{\"\"name\"\":\"\"k8s-master-perfspec\"\"}\",2023-01-27T18:30:53.643535Z,kubernetes-admin,get,daemonsets,,my-prometheus-prometheus-node-exporter,,/apis/apps/v1/namespaces/prometheus/daemonsets/my-prometheus-prometheus-node-exporter,ce1a81bc-6a06-49f4-bfd5-00ef222f137d,ResponseComplete,404,,,",
            "propagation_clusters": [],
            "blast_radius": 0
          },
          "explanation": [
            "Behavior: kubernetes-admin get configmaps (HTTP 404)",
            "Cluster size: 128 events",
            "Error burst detected: 114 anomalous events",
            "Trigger proximity to incident start: 0.578"
          ]
        }
      ]
    },
    {
      "incident_id": "I2",
      "start_time": "2023-01-27T18:30:58.127428+00:00",
      "end_time": "2023-01-27T18:31:48.127428+00:00",
      "explanations": [
        {
          "cluster_id": "C0",
          "behavior": "kubernetes-admin get configmaps client failures (HTTP 404)",
          "score": 48.46207613766254,
          "narrative": {
            "root_cause": "Unknown Component resource_lookup_failure",
            "behavior": "kubernetes-admin get configmaps client failures (HTTP 404)",
            "trigger_event": "\"{\"\"name\"\":\"\"k8s-master-perfspec\"\"}\",2023-01-27T18:31:06.032926Z,kubernetes-admin,get,rolebindings,,my-argo-cd-argocd-applicationset-controller,,/apis/rbac.authorization.k8s.io/v1/namespaces/argo-cd/rolebindings/my-argo-cd-argocd-applicationset-controller,ffb58937-bfd6-4945-b8d0-ce40f76d14ba,ResponseComplete,404,,,",
            "propagation_clusters": [],
            "blast_radius": 0
          },
          "explanation": [
            "Behavior: kubernetes-admin get configmaps (HTTP 404)",
            "Cluster size: 90 events",
            "Error burst detected: 90 anomalous events",
            "Trigger proximity to incident start: 0.955"
          ]
        },
        {
          "cluster_id": "C117",
          "behavior": "k8s-node-1-perfspec patch events client failures (HTTP 404)",
          "score": 32.78636895621705,
          "narrative": {
            "root_cause": "Unknown Component resource_lookup_failure",
            "behavior": "k8s-node-1-perfspec patch events client failures (HTTP 404)",
            "trigger_event": "\"{\"\"name\"\":\"\"k8s-master-perfspec\"\"}\",2023-01-27T18:31:26.258728Z,system:node:k8s-node-1-perfspec,patch,events,,my-loki-logs-8mj42.173e3c8107533d12,,/api/v1/namespaces/loki/events/my-loki-logs-8mj42.173e3c8107533d12,cd45b930-0e98-4f16-a8e7-a20bd0704371,ResponseComplete,404,,,",
            "propagation_clusters": [],
            "blast_radius": 0
          },
          "explanation": [
            "Behavior: system:node:k8s-node-1-perfspec patch events (HTTP 404)",
            "Cluster size: 4 events",
            "Error burst detected: 4 anomalous events",
            "Trigger proximity to incident start: 0.616"
          ]
        },
        {
          "cluster_id": "C188",
          "behavior": "kubernetes-admin get clusterroles client failures (HTTP 404)",
          "score": 29.07874075621705,
          "narrative": {
            "root_cause": "Unknown Component resource_lookup_failure",
            "behavior": "kubernetes-admin get clusterroles client failures (HTTP 404)",
            "trigger_event": "\"{\"\"name\"\":\"\"k8s-master-perfspec\"\"}\",2023-01-27T18:31:43.341039Z,kubernetes-admin,get,rolebindings,,my-kubernetes-dashboard,,/apis/rbac.authorization.k8s.io/v1/namespaces/kubernetes-dashboard/rolebindings/my-kubernetes-dashboard,a1b98046-602c-48e2-9576-fcff631acd91,ResponseComplete,404,,,",
            "propagation_clusters": [],
            "blast_radius": 0
          },
          "explanation": [
            "Behavior: kubernetes-admin get clusterroles (HTTP 404)",
            "Cluster size: 4 events",
            "Error burst detected: 4 anomalous events",
            "Trigger proximity to incident start: 0.331"
          ]
        },
        {
          "cluster_id": "C163",
          "behavior": "Gatekeeper policy evaluation failures",
          "score": 27.869148345186122,
          "narrative": {
            "root_cause": "gatekeeper resource_lookup_failure",
            "behavior": "Gatekeeper policy evaluation failures",
            "trigger_event": "\"{\"\"name\"\":\"\"k8s-master-perfspec\"\"}\",2023-01-27T18:28:22.470778Z,system:serviceaccount:gatekeeper-system:gatekeeper-admin,list,assignmetadata,,,,/apis/mutations.gatekeeper.sh/v1/assignmetadata?resourceVersion=6135961,2c893351-f825-40f8-9bf7-19ff1de0fb4f,ResponseComplete,404,,,",
            "propagation_clusters": [
              "C118",
              "C152",
              "C156",
              "C161",
              "C179",
              "C18",
              "C181",
              "C187",
              "C220",
              "C36",
              "C7",
              "C96"
            ],
            "blast_radius": 12
          },
          "explanation": [
            "Behavior: system:serviceaccount:gatekeeper-system:gatekeeper-admin list constrainttemplates (HTTP 404)",
            "Cluster size: 112 events",
            "Error burst detected: 108 anomalous events",
            "Trigger proximity to incident start: 1.0",
            "Downstream clusters affected: 12"
          ]
        },
        {
          "cluster_id": "C182",
          "behavior": "Secret lookup failures",
          "score": 25.96797965567298,
          "narrative": {
            "root_cause": "Unknown Component normal_operation",
            "behavior": "Secret lookup failures",
            "trigger_event": "\"{\"\"name\"\":\"\"k8s-master-perfspec\"\"}\",2023-01-27T18:31:20.098948Z,kubernetes-admin,create,secrets,,my-redis,,/api/v1/namespaces/redis/secrets?fieldManager=helm,70542958-e2f3-40e2-9ca1-6fd476f12d40,ResponseComplete,201,,,",
            "propagation_clusters": [],
            "blast_radius": 0
          },
          "explanation": [
            "Behavior: kubernetes-admin get secrets (HTTP 404)",
            "Cluster size: 27 events",
            "Error burst detected: 13 anomalous events",
            "Trigger proximity to incident start: 0.733"
          ]
        }
      ]
    }
  ]
}

run_20260311_001604/incident_explanations.md

### Cluster C31

- Behavior: system:serviceaccount:kube-prometheus-stack:my-kube-prometheus-stack-operator get secrets (HTTP 200)
- Cluster size: 1343 events
- Error burst detected: 222 anomalous events
- Trigger proximity to incident start: 0.482
- Downstream clusters affected: 15

### Cluster C18

- Behavior: kubernetes-admin create customresourcedefinitions (HTTP 409)
- Cluster size: 30 events
- Error burst detected: 17 anomalous events
- Trigger proximity to incident start: 0.676
- Downstream clusters affected: 14

### Cluster C19

- Behavior: kubernetes-admin get configmaps (HTTP 404)
- Cluster size: 128 events
- Error burst detected: 114 anomalous events
- Trigger proximity to incident start: 0.578

### Cluster C0

- Behavior: kubernetes-admin get configmaps (HTTP 404)
- Cluster size: 90 events
- Error burst detected: 90 anomalous events
- Trigger proximity to incident start: 0.955

### Cluster C117

- Behavior: system:node:k8s-node-1-perfspec patch events (HTTP 404)
- Cluster size: 4 events
- Error burst detected: 4 anomalous events
- Trigger proximity to incident start: 0.616

### Cluster C188

- Behavior: kubernetes-admin get clusterroles (HTTP 404)
- Cluster size: 4 events
- Error burst detected: 4 anomalous events
- Trigger proximity to incident start: 0.331

### Cluster C182

- Behavior: kubernetes-admin get secrets (HTTP 404)
- Cluster size: 27 events
- Error burst detected: 13 anomalous events
- Trigger proximity to incident start: 0.733