run_20260309_222930/incident_I2.json

{
  "incident_id": "I2",
  "incident_window": {
    "start_time": "2023-01-27T18:30:58.127428+00:00",
    "end_time": "2023-01-27T18:31:48.127428+00:00"
  },
  "root_cause": {
    "cluster_id": "C0",
    "score": 44.46207613766254,
    "confidence": {
      "value": 0.598,
      "label": "medium"
    },
    "cluster_summary": {
      "cluster_id": "C0",
      "size": 90,
      "cluster_type": "candidate",
      "first_seen_ts": "2023-01-27T18:31:05.897828Z",
      "last_seen_ts": "2023-01-27T18:31:07.610333Z",
      "top_services": [
        {
          "service": "kubernetes-admin",
          "count": 90
        }
      ],
      "http_class_counts": {
        "4xx": 90
      },
      "example_events": [
        "\"{\"\"name\"\":\"\"k8s-master-perfspec\"\"}\",2023-01-27T18:31:06.563331Z,kubernetes-admin,get,secrets,,argocd-notifications-secret,,/api/v1/namespaces/argo-cd/secrets/argocd-notifications-secret,46e5ff61-5bc9-4c76-92b0-9cb74840cdf8,ResponseComplete,404,,,",
        "\"{\"\"name\"\":\"\"k8s-master-perfspec\"\"}\",2023-01-27T18:31:06.579356Z,kubernetes-admin,get,secrets,,argocd-secret,,/api/v1/namespaces/argo-cd/secrets/argocd-secret,d2d53226-820b-4323-87c4-840f8b4fd48c,ResponseComplete,404,,,",
        "\"{\"\"name\"\":\"\"k8s-master-perfspec\"\"}\",2023-01-27T18:31:06.591658Z,kubernetes-admin,get,configmaps,,argocd-cm,,/api/v1/namespaces/argo-cd/configmaps/argocd-cm,a059b8d2-6f8f-49d8-86c8-9168e1ae6481,ResponseComplete,404,,,"
      ]
    },
    "representative_event": {
      "timestamp": "2023-01-27T18:31:06.032926Z",
      "service": "kubernetes-admin",
      "response_code": 404,
      "text": "\"{\"\"name\"\":\"\"k8s-master-perfspec\"\"}\",2023-01-27T18:31:06.032926Z,kubernetes-admin,get,rolebindings,,my-argo-cd-argocd-applicationset-controller,,/apis/rbac.authorization.k8s.io/v1/namespaces/argo-cd/rolebindings/my-argo-cd-argocd-applicationset-controller,ffb58937-bfd6-4945-b8d0-ce40f76d14ba,ResponseComplete,404,,,"
    },
    "first_seen_event": {
      "timestamp": "2023-01-27T18:31:05.897828Z",
      "service": "kubernetes-admin",
      "response_code": 404,
      "text": "\"{\"\"name\"\":\"\"k8s-master-perfspec\"\"}\",2023-01-27T18:31:05.897828Z,kubernetes-admin,get,serviceaccounts,,argocd-application-controller,,/api/v1/namespaces/argo-cd/serviceaccounts/argocd-application-controller,9fa13790-8f95-410b-8f01-f751a31f579c,ResponseComplete,404,,,"
    },
    "signals": {
      "trigger_score": 4.721854,
      "error_count": 90,
      "trigger_proximity": 0.9549606666666667,
      "in_weight": 0.0,
      "out_weight": 0.0,
      "severity_counts": {
        "ERROR": 0,
        "WARN": 90,
        "INFO": 0,
        "OTHER": 0
      },
      "trigger_stats": {
        "first_seen": "2023-01-27T18:31:05.897828+00:00",
        "last_seen": "2023-01-27T18:31:07.610333+00:00",
        "event_count": 90,
        "error_count": 90,
        "duration_seconds": 1.712505,
        "error_rate": 1.0,
        "severity": 3.0,
        "cluster_rate_eps": 52.554591,
        "global_rate_eps": 67.788921,
        "burst_factor": 0.775268,
        "trigger_score": 4.721854
      }
    },
    "graph_context": {
      "incoming_edges": [],
      "outgoing_edges": [],
      "in_degree": 0,
      "out_degree": 0
    },
    "why_ranked_first": [
      "highest composite RCA score for this incident",
      "strong downstream influence relative to incoming influence",
      "appears early relative to incident onset",
      "shows abnormal trigger/error behavior"
    ]
  },
  "other_candidates": [
    {
      "cluster_id": "C117",
      "score": 34.58165,
      "confidence": {
        "value": 0.439,
        "label": "low"
      },
      "trigger_score": 3.171994,
      "error_count": 4,
      "cluster_summary": {
        "cluster_id": "C117",
        "size": 4,
        "cluster_type": "candidate",
        "first_seen_ts": "2023-01-27T18:31:26.258728Z",
        "last_seen_ts": "2023-01-27T18:31:26.299083Z",
        "top_services": [
          {
            "service": "system:node:k8s-node-1-perfspec",
            "count": 2
          },
          {
            "service": "system:node:k8s-node-2-perfspec",
            "count": 2
          }
        ],
        "http_class_counts": {
          "4xx": 4
        },
        "example_events": [
          "\"{\"\"name\"\":\"\"k8s-master-perfspec\"\"}\",2023-01-27T18:31:26.258728Z,system:node:k8s-node-1-perfspec,patch,events,,my-loki-logs-8mj42.173e3c8107533d12,,/api/v1/namespaces/loki/events/my-loki-logs-8mj42.173e3c8107533d12,cd45b930-0e98-4f16-a8e7-a20bd0704371,ResponseComplete,404,,,",
          "\"{\"\"name\"\":\"\"k8s-master-perfspec\"\"}\",2023-01-27T18:31:26.285401Z,system:node:k8s-node-1-perfspec,create,events,,my-loki-logs-8mj42.173e3c8107533d12,,/api/v1/namespaces/loki/events,cd4c339c-5da5-4e36-842e-f51243096dcc,ResponseComplete,403,,,",
          "\"{\"\"name\"\":\"\"k8s-master-perfspec\"\"}\",2023-01-27T18:31:26.295182Z,system:node:k8s-node-2-perfspec,patch,events,,my-loki-logs-psflx.173e3bd1729e54a4,,/api/v1/namespaces/loki/events/my-loki-logs-psflx.173e3bd1729e54a4,ab1dbac3-440c-4ab3-98be-b3ee89268e8f,ResponseComplete,404,,,"
        ]
      },
      "representative_event": {
        "timestamp": "2023-01-27T18:31:26.258728Z",
        "service": "system:node:k8s-node-1-perfspec",
        "response_code": 404,
        "text": "\"{\"\"name\"\":\"\"k8s-master-perfspec\"\"}\",2023-01-27T18:31:26.258728Z,system:node:k8s-node-1-perfspec,patch,events,,my-loki-logs-8mj42.173e3c8107533d12,,/api/v1/namespaces/loki/events/my-loki-logs-8mj42.173e3c8107533d12,cd45b930-0e98-4f16-a8e7-a20bd0704371,ResponseComplete,404,,,"
      }
    },
    {
      "cluster_id": "C188",
      "score": 27.07874075621705,
      "confidence": {
        "value": 0.317,
        "label": "low"
      },
      "trigger_score": 3.171994,
      "error_count": 4,
      "cluster_summary": {
        "cluster_id": "C188",
        "size": 4,
        "cluster_type": "candidate",
        "first_seen_ts": "2023-01-27T18:31:43.335010Z",
        "last_seen_ts": "2023-01-27T18:31:43.341039Z",
        "top_services": [
          {
            "service": "kubernetes-admin",
            "count": 4
          }
        ],
        "http_class_counts": {
          "4xx": 4
        },
        "example_events": [
          "\"{\"\"name\"\":\"\"k8s-master-perfspec\"\"}\",2023-01-27T18:31:43.335010Z,kubernetes-admin,get,clusterroles,,my-kubernetes-dashboard-metrics,,/apis/rbac.authorization.k8s.io/v1/clusterroles/my-kubernetes-dashboard-metrics,01744a2d-f34e-476a-94dc-99afb9360bc7,ResponseComplete,404,,,",
          "\"{\"\"name\"\":\"\"k8s-master-perfspec\"\"}\",2023-01-27T18:31:43.336935Z,kubernetes-admin,get,clusterrolebindings,,my-kubernetes-dashboard-metrics,,/apis/rbac.authorization.k8s.io/v1/clusterrolebindings/my-kubernetes-dashboard-metrics,eec9e005-338b-49c2-a708-71dd1746d923,ResponseComplete,404,,,",
          "\"{\"\"name\"\":\"\"k8s-master-perfspec\"\"}\",2023-01-27T18:31:43.338849Z,kubernetes-admin,get,roles,,my-kubernetes-dashboard,,/apis/rbac.authorization.k8s.io/v1/namespaces/kubernetes-dashboard/roles/my-kubernetes-dashboard,d84403f7-4689-44e6-8554-e65c909a698e,ResponseComplete,404,,,"
        ]
      },
      "representative_event": {
        "timestamp": "2023-01-27T18:31:43.341039Z",
        "service": "kubernetes-admin",
        "response_code": 404,
        "text": "\"{\"\"name\"\":\"\"k8s-master-perfspec\"\"}\",2023-01-27T18:31:43.341039Z,kubernetes-admin,get,rolebindings,,my-kubernetes-dashboard,,/apis/rbac.authorization.k8s.io/v1/namespaces/kubernetes-dashboard/rolebindings/my-kubernetes-dashboard,a1b98046-602c-48e2-9576-fcff631acd91,ResponseComplete,404,,,"
      }
    },
    {
      "cluster_id": "C27",
      "score": 25.830978832284316,
      "confidence": {
        "value": 0.428,
        "label": "low"
      },
      "trigger_score": 0.136381,
      "error_count": 11,
      "cluster_summary": {
        "cluster_id": "C27",
        "size": 85,
        "cluster_type": "candidate",
        "first_seen_ts": "2023-01-27T18:31:06.473918Z",
        "last_seen_ts": "2023-01-27T18:31:29.136143Z",
        "top_services": [
          {
            "service": "kube-system/deployment-controller",
            "count": 35
          },
          {
            "service": "kube-system/endpointslice-controller",
            "count": 22
          },
          {
            "service": "kube-system/endpoint-controller",
            "count": 13
          },
          {
            "service": "system:kube-controller-manager",
            "count": 12
          },
          {
            "service": "kube-system/statefulset-controller",
            "count": 3
          }
        ],
        "http_class_counts": {
          "2xx": 74,
          "4xx": 11
        },
        "example_events": [
          "\"{\"\"name\"\":\"\"k8s-master-perfspec\"\"}\",2023-01-27T18:31:06.563223Z,system:kube-controller-manager,get,serviceaccounts,,argocd-dex-server,,/api/v1/namespaces/argo-cd/serviceaccounts/argocd-dex-server,3cb7bdf5-aa75-4112-b772-adb24ebf7ad4,ResponseComplete,200,,,",
          "\"{\"\"name\"\":\"\"k8s-master-perfspec\"\"}\",2023-01-27T18:31:06.557822Z,system:kube-controller-manager,update,serviceaccounts,,my-argo-cd-argocd-repo-server,,/api/v1/namespaces/argo-cd/serviceaccounts/my-argo-cd-argocd-repo-server,3875c939-a7d2-4f84-9836-6187c4b650b9,ResponseComplete,200,,,",
          "\"{\"\"name\"\":\"\"k8s-master-perfspec\"\"}\",2023-01-27T18:31:06.561568Z,system:kube-controller-manager,update,serviceaccounts,,argocd-server,,/api/v1/namespaces/argo-cd/serviceaccounts/argocd-server,709a41c2-ebf5-4d31-9209-118fa2c1f64d,ResponseComplete,200,,,"
        ]
      },
      "representative_event": {
        "timestamp": "2023-01-27T18:31:07.437877Z",
        "service": "kube-system/deployment-controller",
        "response_code": 200,
        "text": "\"{\"\"name\"\":\"\"k8s-master-perfspec\"\"}\",2023-01-27T18:31:07.437877Z,system:serviceaccount:kube-system:deployment-controller,update,deployments,status,my-argo-cd-argocd-applicationset-controller,,/apis/apps/v1/namespaces/argo-cd/deployments/my-argo-cd-argocd-applicationset-controller/status,3f3cec5f-6f92-4099-877c-99d409503302,ResponseComplete,200,,,"
      }
    },
    {
      "cluster_id": "C182",
      "score": 21.96797965567298,
      "confidence": {
        "value": 0.291,
        "label": "low"
      },
      "trigger_score": 1.268982,
      "error_count": 13,
      "cluster_summary": {
        "cluster_id": "C182",
        "size": 27,
        "cluster_type": "candidate",
        "first_seen_ts": "2023-01-27T18:31:19.213478Z",
        "last_seen_ts": "2023-01-27T18:31:20.278194Z",
        "top_services": [
          {
            "service": "kubernetes-admin",
            "count": 26
          },
          {
            "service": "system:kube-controller-manager",
            "count": 1
          }
        ],
        "http_class_counts": {
          "2xx": 14,
          "4xx": 13
        },
        "example_events": [
          "\"{\"\"name\"\":\"\"k8s-master-perfspec\"\"}\",2023-01-27T18:31:19.213478Z,kubernetes-admin,list,secrets,,,,/api/v1/namespaces/redis/secrets?labelSelector=name%3Dmy-redis%2Cowner%3Dhelm,75f33575-3d70-435b-ab5e-252b4de6883d,ResponseComplete,200,,,",
          "\"{\"\"name\"\":\"\"k8s-master-perfspec\"\"}\",2023-01-27T18:31:19.348486Z,kubernetes-admin,get,secrets,,my-redis,,/api/v1/namespaces/redis/secrets/my-redis,6ba9c295-21d8-43ce-8e5d-26cb1ea5eab0,ResponseComplete,404,,,",
          "\"{\"\"name\"\":\"\"k8s-master-perfspec\"\"}\",2023-01-27T18:31:19.430437Z,kubernetes-admin,get,secrets,,my-redis,,/api/v1/namespaces/redis/secrets/my-redis,c5bd4338-d453-42a9-bd5c-4e3872161228,ResponseComplete,404,,,"
        ]
      },
      "representative_event": {
        "timestamp": "2023-01-27T18:31:20.098948Z",
        "service": "kubernetes-admin",
        "response_code": 201,
        "text": "\"{\"\"name\"\":\"\"k8s-master-perfspec\"\"}\",2023-01-27T18:31:20.098948Z,kubernetes-admin,create,secrets,,my-redis,,/api/v1/namespaces/redis/secrets?fieldManager=helm,70542958-e2f3-40e2-9ca1-6fd476f12d40,ResponseComplete,201,,,"
      }
    }
  ],
  "timeline": [
    {
      "timestamp": "2023-01-27T18:31:05.897828Z",
      "cluster_id": "C0",
      "score": 44.46207613766254,
      "service": "kubernetes-admin",
      "response_code": 404,
      "summary": "\"{\"\"name\"\":\"\"k8s-master-perfspec\"\"}\",2023-01-27T18:31:05.897828Z,kubernetes-admin,get,serviceaccounts,,argocd-application-controller,,/api/v1/namespaces/argo-cd/serviceaccounts/argocd-application-controller,9fa13790-8f95-410b-8f01-f751a31f579c,ResponseComplete,404,,,"
    },
    {
      "timestamp": "2023-01-27T18:31:06.473918Z",
      "cluster_id": "C27",
      "score": 25.830978832284316,
      "service": "system:kube-controller-manager",
      "response_code": 200,
      "summary": "\"{\"\"name\"\":\"\"k8s-master-perfspec\"\"}\",2023-01-27T18:31:06.473918Z,system:kube-controller-manager,get,serviceaccounts,,argocd-application-controller,,/api/v1/namespaces/argo-cd/serviceaccounts/argocd-application-controller,59f21724-d7f9-4a03-967c-0afdd935b834,ResponseComplete,200,,,"
    },
    {
      "timestamp": "2023-01-27T18:31:19.213478Z",
      "cluster_id": "C182",
      "score": 21.96797965567298,
      "service": "kubernetes-admin",
      "response_code": 200,
      "summary": "\"{\"\"name\"\":\"\"k8s-master-perfspec\"\"}\",2023-01-27T18:31:19.213478Z,kubernetes-admin,list,secrets,,,,/api/v1/namespaces/redis/secrets?labelSelector=name%3Dmy-redis%2Cowner%3Dhelm,75f33575-3d70-435b-ab5e-252b4de6883d,ResponseComplete,200,,,"
    },
    {
      "timestamp": "2023-01-27T18:31:26.258728Z",
      "cluster_id": "C117",
      "score": 34.58165,
      "service": "system:node:k8s-node-1-perfspec",
      "response_code": 404,
      "summary": "\"{\"\"name\"\":\"\"k8s-master-perfspec\"\"}\",2023-01-27T18:31:26.258728Z,system:node:k8s-node-1-perfspec,patch,events,,my-loki-logs-8mj42.173e3c8107533d12,,/api/v1/namespaces/loki/events/my-loki-logs-8mj42.173e3c8107533d12,cd45b930-0e98-4f16-a8e7-a20bd0704371,ResponseComplete,404,,,"
    },
    {
      "timestamp": "2023-01-27T18:31:43.335010Z",
      "cluster_id": "C188",
      "score": 27.07874075621705,
      "service": "kubernetes-admin",
      "response_code": 404,
      "summary": "\"{\"\"name\"\":\"\"k8s-master-perfspec\"\"}\",2023-01-27T18:31:43.335010Z,kubernetes-admin,get,clusterroles,,my-kubernetes-dashboard-metrics,,/apis/rbac.authorization.k8s.io/v1/clusterroles/my-kubernetes-dashboard-metrics,01744a2d-f34e-476a-94dc-99afb9360bc7,ResponseComplete,404,,,"
    }
  ],
  "stats": {
    "candidate_count": 5,
    "has_root_cause": true
  }
}

run_20260309_222930/incident_explanations.md

### Cluster C0

Behavior: kubernetes-admin get configmaps client failures (HTTP 404)
Score: 44.46

- Behavior: kubernetes-admin get configmaps (HTTP 404)
- Cluster size: 90 events
- Error burst detected: 90 anomalous events
- Trigger proximity to incident start: 0.955

### Cluster C117

Behavior: k8s-node-1-perfspec patch events client failures (HTTP 404)
Score: 34.58

### Cluster C188

Behavior: kubernetes-admin get clusterroles client failures (HTTP 404)
Score: 27.08

### Cluster C27

Behavior: deployment-controller update deployments operations (HTTP 200)
Score: 25.83